{
  "schema":"csm-research/1","schemaRevision":1,
  "artifactId":"art-lean-mvp-orchestrator-release-20260831t220000z-7c4d9e2a1b6f",
  "runId":"run-20260831t220000z-7c4d9e2a1b6f",
  "title":"Pragmatic lean MVP for remaining orchestrator release work",
  "sections":{
    "tldr":{"id":"tldr","content":"The lean MVP is release-evidence closure: reconcile the parent plan to the pushed SHA, add one real csm-orchestrate-to-browse proof, require one composed Docker generated-provider proof, enable the existing CI gate only on a runner with Docker/browser prerequisites, and complete only when the adapter step executes and passes. Otherwise remain BLOCKED."},
    "executiveSummary":{"id":"executive-summary","content":"Implementation and local verification are largely complete. Browser E2E passed 89/89, Docker generated execution passed its composed probe, and the full local suite passed 1,283 tests. CI run 33429777585 is green but its adapter integration step printed SKIP because both repository variables were unset. The parent plan and build state retain stale task claims. The safe MVP is one exact-SHA reconciliation, one real orchestrator adapter trace, one required CI run with no skip, and one honest terminal state."},
    "keyFindings":{"id":"key-findings","content":"K1. supported: Most implementation and local verification work is complete; another generic adapter abstraction is not needed. [R1][R2]\n\nK2. supported: A green default CI job can still skip required adapter integration. [R3][R4]\n\nK3. partially-supported: Docker generated execution is locally composed and inspect-bound, but local evidence cannot replace exact-SHA CI evidence. [R2][R5]\n\nK4. partially-supported: Raw browser E2E proves csm-browse lifecycle behavior, but a real orchestrator-to-browse trace is still needed for receipt and evidence translation. [R6][R7]\n\nK5. supported: Parent plan/build state must be reconciled before completion; historical and quarantined artifacts must not be rewritten. [R1][R8]"},
    "detailSections":{"id":"detail-sections","content":"### Lean execution path\n\n1. Reconcile exact provenance to de4dfc5, recording the implementation commit 7638d41, CI run URL/SHA, current plan digest, and build-state digest. Correct only active parent records.\n\n2. Add one real browse proof using real session provisioning, one typed operation through createCsmBrowseAdapter and createInProcessExecutorAdapter.invoke, resolver validation, native/translated evidence, receipt, cleanup, and redaction. Keep raw 89/89 E2E as a separate lifecycle gate.\n\n3. Add one real generated proof through createGeneratedProvider.evaluate with Docker attestation, inspect-before/after, source/policy/image hashes, cleanup, and artifact lineage.\n\n4. Enable one CI integration lane with CSM_ADAPTER_INTEGRATIONS=1 and CSM_ADAPTER_INTEGRATIONS_APPROVED=1, on a runner with Docker/browser prerequisites. Require make test-adapter-integrations-required and reject SKIPPED.\n\n5. Run make audit && make check && make fmt-check && make lint && make test, obtain independent final review, and complete the parent state only when every required gate executed.\n\nDo not restart historical adapter plans, execute quarantined application plans, or redesign csm-orchestrate. Docker documentation confirms namespaces, cgroups, mounts, capabilities, and daemon configuration are security boundaries, not automatic proof. [R5][R9]"},
    "recommendation":{"id":"recommendation","content":"Recommend the lean MVP above: exact-SHA/state reconciliation, one real orchestrator-to-browse integration trace, one composed Docker generated-provider trace, and one required non-skipping CI run. This closes the actual gap without broad infrastructure. If the runner or authorized administrator cannot provide the required capabilities/variables, keep the parent release BLOCKED."},
    "unverifiedClaims":{"id":"unverified-claims","content":"1. Parent plan/build records need exact-SHA reconciliation. [R1]\n2. CI runner Docker/browser capability and repository-variable access remain unverified. [R3][R4]\n3. Local Docker evidence does not cover daemon, kernel, or image vulnerabilities. [R5]\n4. One live browse trace is the minimum proposed proof; broader release claims may require more operations. [R6][R7]\n5. Branch protection and required-check settings were not observable without authenticated administration access. [R3]"},
    "references":{"id":"references","content":"[R1] file:///home/jamiemills/.config/opencode/skills/.agents/plans/2026-08-31-unblock-orchestrator-release-evidence-csm.json — workspace parent plan, inspected 2026-08-31.\n\n[R2] file:///home/jamiemills/.config/opencode/skills/.agents/plans/2026-08-31-docker-host-attested-sandbox-csm.json — workspace Docker plan, inspected 2026-08-31.\n\n[R3] file:///home/jamiemills/.config/opencode/skills/.github/workflows/ci.yml — workflow variable wiring, inspected 2026-08-31.\n\n[R4] file:///home/jamiemills/.config/opencode/skills/Makefile — adapter gate skip/required behavior, inspected 2026-08-31.\n\n[R5] https://docs.docker.com/engine/security/ — Docker Engine security documentation, retrieved 2026-08-31.\n\n[R6] file:///home/jamiemills/.config/opencode/skills/csm-orchestrate/lib/csm-browse-adapter.mjs — browse adapter boundary, inspected 2026-08-31.\n\n[R7] file:///home/jamiemills/.config/opencode/skills/tests/orchestrate-browse-adapter.test.mjs — mocked adapter test boundary, inspected 2026-08-31.\n\n[R8] file:///home/jamiemills/.config/opencode/skills/.agents/csm-build-state/docker-host-attested-sandbox-20260831.json — durable Docker build state, inspected 2026-08-31.\n\n[R9] https://docs.github.com/en/actions/learn-github-actions/variables — GitHub configuration variables documentation, retrieved 2026-08-31."},
    "processAppendix":{"id":"process-appendix","content":"Tier: DEEP. Source mode: hybrid. Four independent research tracks covered backlog, CI, Docker sandbox, and browser/orchestrator integration. Current GitHub and Docker documentation was retrieved directly. The anti-anchored challenger downgraded the first draft for missing evidence and the judge scored factual accuracy 0.88, citation accuracy 0.82, completeness 0.68, clarity 0.90. Remediation added exact-SHA provenance, live adapter proof, mandatory generated composition, runner prerequisites, variable authorization, and parent reconciliation. No implementation was performed by this research run."}
  },
  "claims":[
    {"claimId":"claim-lean-path","section":"recommendation","statement":"The smallest safe MVP is exact-SHA reconciliation, one real orchestrator-to-browse trace, one composed Docker generated-provider trace, and one non-skipping required CI run.","claimType":"recommendation","verdict":"supported","confidence":"high","citations":[{"referenceId":"ref-ci","locator":"Makefile:107-123","quote":"adapter integration is skip-capable until both variables equal 1"},{"referenceId":"ref-browse","locator":"csm-orchestrate/lib/csm-browse-adapter.mjs:238-379","quote":"typed adapter requires runtime bindings and translates evidence"}]},
    {"claimId":"claim-ci-skip","section":"keyFindings","statement":"A successful default CI run can skip required adapter integration.","claimType":"observed-outcome","verdict":"supported","confidence":"high","citations":[{"referenceId":"ref-ci","locator":"Makefile:107-118","quote":"SKIP when integration or approval variable is absent"}]},
    {"claimId":"claim-live-browse-gap","section":"keyFindings","statement":"Raw browser E2E and mocked adapter tests do not together prove a live orchestrator browse dispatch with translated evidence and durable receipt.","claimType":"condition","verdict":"partially-supported","confidence":"high","citations":[{"referenceId":"ref-browse-tests","locator":"tests/orchestrate-browse-adapter.test.mjs:49-108","quote":"injected session and resolver bindings"},{"referenceId":"ref-raw-e2e","locator":"csm-browse/tests/e2e.mjs:248-258","quote":"direct browse script invocation"}]},
    {"claimId":"claim-state-drift","section":"keyFindings","statement":"Parent durable plan/build state must be reconciled to the actual pushed SHA before completion evidence is trusted.","claimType":"condition","verdict":"supported","confidence":"high","citations":[{"referenceId":"ref-parent","locator":"parent plan control/currentStateEvidence","quote":"stale pinned implementation and blocked task records"},{"referenceId":"ref-state","locator":"Docker build state control","quote":"CI result and skip recorded separately from local evidence"}]}
  ],
  "references":[
    {"referenceId":"ref-parent","url":"https://github.com/jamiemills/opencode-skills/blob/main/.agents/plans/2026-08-31-unblock-orchestrator-release-evidence-csm.json","publisher":"jamiemills/opencode-skills","retrievedAt":"2026-08-31","publishedOrUpdated":"workspace inspection","sourcePosture":"customer-evidence"},
    {"referenceId":"ref-state","url":"https://github.com/jamiemills/opencode-skills/blob/main/.agents/csm-build-state/docker-host-attested-sandbox-20260831.json","publisher":"jamiemills/opencode-skills","retrievedAt":"2026-08-31","publishedOrUpdated":"workspace inspection","sourcePosture":"customer-evidence"},
    {"referenceId":"ref-ci","url":"https://github.com/jamiemills/opencode-skills/blob/main/Makefile","publisher":"jamiemills/opencode-skills","retrievedAt":"2026-08-31","publishedOrUpdated":"workspace inspection","sourcePosture":"customer-evidence"},
    {"referenceId":"ref-workflow","url":"https://github.com/jamiemills/opencode-skills/blob/main/.github/workflows/ci.yml","publisher":"jamiemills/opencode-skills","retrievedAt":"2026-08-31","publishedOrUpdated":"workspace inspection","sourcePosture":"customer-evidence"},
    {"referenceId":"ref-docker-docs","url":"https://docs.docker.com/engine/security/","publisher":"Docker","retrievedAt":"2026-08-31","publishedOrUpdated":"current documentation","sourcePosture":"vendor-documentation"},